{
  "schema_version": "8.0",
  "source_schema_version": "7.0",
  "generated_at": "2026-10-16T16:48:42.356254+00:00",
  "engine": "P01-008",
  "rules_version": "1.0",
  "regime": "RISK_OFF",
  "risk_score": 100,
  "risk_level": "HIGH",
  "confidence": 0.064,
  "evidence_coverage": 0.4,
  "risk_drivers": [
    {
      "metric_id": "DXY",
      "signal_id": "FIRM_DOLLAR",
      "direction": "RISK_OFF",
      "strength": "MODERATE",
      "contribution_share": 1.0,
      "signal_confidence": 1.0,
      "risk_impact": 30.0
    }
  ],
  "protective_factors": [],
  "excluded": [
    {
      "metric_id": "US10Y",
      "direction": "UNKNOWN",
      "reason": "DATA_QUALITY_GATE_FAILED"
    },
    {
      "metric_id": "BTC",
      "direction": "UNKNOWN",
      "reason": "INSUFFICIENT_HISTORY"
    },
    {
      "metric_id": "ETH",
      "direction": "UNKNOWN",
      "reason": "INSUFFICIENT_HISTORY"
    }
  ],
  "summary": {
    "risk_driver_count": 1,
    "protective_factor_count": 0,
    "eligible_drivers": 2,
    "excluded_signals": 3
  },
  "semantics": {
    "risk_score": "Deterministic composite assessment from current regime, attributed evidence, coverage, and confidence. Higher values indicate higher assessed market risk.",
    "risk_level": "Descriptive classification of current assessed market risk; not a forecast of future returns.",
    "confidence": "Reliability of the risk assessment given upstream evidence and coverage; not probability of a future market outcome.",
    "recommendation": "The engine does not emit BUY/SELL/LONG/SHORT/PAY/EXECUTE recommendations."
  }
}